,Timestamp,What's your name?,What track are you in?,What team are you in?,What language(s) do you speak? This includes any languages you are currently learning!,What did you do before Lambda? (Previous work),"What's one of your strengths, when it comes to technical skills?",What's one area of improvement for your technical skills?,"What's one of your strengths, when it comes to working in a team?",What is one area of improvement for your teamwork skills?,"In 10 words or less, what's your goal for Labs?",How confident are you with your writing? (1 == no confidence; 10 == fully confident),"What's one of your strengths, when it comes to writing?",What's something you'd like to improve about your writing?,"Do you have any experience in the following things? Check off all that you have experience in. (If you do any of this kind of writing as a hobby, that counts! If you don't have any experience with these types of writing, that's ok!)","When watching a movie, what do you pay the most attention to?",Is there anything else you would like me to know?
0,6/3/2021 17:58:50,2621454760417245479,Web,HRF Asylum B -- TPL Niki,"English, Hebrew, and French",McDonalds and Uber Food Delivery,"I'm an extremely fast learner when it comes to new languages, toolsets, modules, etc.",I have a hard time thinking creatively on how to apply my skills. I can get anything done but I wont think to do it.,I'm good at following directions and helping others if they fall behind.,I'm very shy and have a hard time bringing my thoughts and skills forward in discussions.,Feel better prepared to enter the programming workforce.,8,"I've written a lot of professional emails, documents, and even stories. Thus, I'm very fluent and my words are on point.",My writing could always use some more grammar checks!,"Creative writing, Songwriting, Public relations",The script,"I know I might hide in the back of the zoom call a lot of the time, but I always want people to know that I'm very passionate about programming! I quit becoming a chemist to pursue this dream job of mine, and while my demeanor may not show it I hope the quality of my work will! :)"
1,6/3/2021 18:00:14,5994165238280524316,Web,HRF Asylum B -- TPL Niki,"English, Spanish",High School student,Focus,Algorithms,Patience,Communication,Get the same experience I would get as if I were in an actual job,7,Concise thoughts,Grammar,None of the above,The visuals,No
2,6/3/2021 18:06:59,-1413717646902054395,Web,HRF Asylum B -- TPL Niki,English,"Heating, Ventilation, Air Conditioning (HVAC) for 28 years",Determination to get the task done,Cleaner code,Not sure. I've mostly worked solo my entire life.,Not sure. I've mostly worked solo my entire life.,Learn to work with a team ;),5,Not sure...,Everything,None of the above,The visuals,
3,6/3/2021 18:19:39,-8753455328810264548,Web,HRF Asylum B -- TPL Niki,"English, French",I made T-shirt designs and other merchandise along with logos. ,I think I excel in the frontend and design. Css is my favorite. ,My backend skills need some improvement. ,I believe one of my strengths is communication. ,I think I need to improve my leadership skills. I am pretty shy and sometimes have a hard time taking the initiative. ,I want to improve my teamwork skills and design skills!,8,"I love to write, its one of my favorite hobbies so, I think a strength is my familiarity with writing. ",I'd like to improve my grammar. (lifelong struggle) haha!,Creative writing,The script,Excited!
4,6/3/2021 18:35:26,1054517455664425677,Web,HRF Asylum B -- TPL Niki,I speak English. I am learning German. ,I was an ESL Teacher/Administrator. ,I am very good at debugging and remaining calm when/if there is a merge conflict and code gets deleted. This is possibly due to experience. I am so glad Niki is the Approver of all code.,Confidence. ,Remaining communicative when things are not going well. I am also really good at taking breaks. I know when I have reached my limit. ,"It's a growth edge for me being on mostly all male teams. In education, it was completely the opposite. So, finding the right balance of being assertive yet not too pushy is something that I am working on.",I want to feel super confident about the code I contribute. ,10,"I love writing. I was an English major, so I have written tons of academic papers. I recently started a blog. It's so much fun developing my writing voice. ","For me, writing about code is very difficult and rather boring. I much prefer writing about my experience coding rather than the writing being technical. I want to push myself to put my own spin on technical writing. ","Creative writing, Blogging, Twitter threads",The visuals,:)
5,6/3/2021 22:54:49,-8400913884701662892,Web,HRF Asylum B -- TPL Niki,"English, French, Italian, German",I was (still am) an opera singer,"When it comes to technical skills, I'm proud of my ability to write terse and reusable code.","As far as improvement is concerned, I'm sometimes cautious about my 'pure' algorithmic skills. I tend to sometimes think about the most efficient process within a 'framework' or 'language' rather than the bigger picture.","When a topic is 'in my wheelhouse', I'm super happy to take the lead / or help my teammates to understand a concept / implementation detail / framework where they might be unfamiliar.",Sometimes I forget how important it is to listen to others work through and solve similar problems to ones I've faced and overcome before.,To ameliorate the aspects of professional development which I can.,8,I understand the importance of choosing words / constructs to convey specific intents,My writing can sometimes be too audience specific.,"Journalism, Creative writing, Songwriting",The script,"I think I'm 'good', but I want to be PUSHED!"
6,6/4/2021 13:03:07,1133487419227080775,Web,HRF Asylum B -- TPL Niki,"English, Spanish, Python, JavaScript","College student, working at a warehouse during the summer","I'm good at writing clean and organized code. I also choose explicit and descriptive variable names and function declarations. I also prefer writing explicit code instead of short and clever code that only I would understand at first glance, but perhaps one could argue for writing concise code.

I'm also very good at communicating through writing and I'm good at writing mechanically. I also like to be precise in my writing.","The highest level of understanding I reached in CS was linked lists. I understand the high-level conception of binary trees and graphs and their use cases, but I would not know how to implement them in a project.

I'm not a very good verbal communicator. I believe it might because I'm heavily skewed towards trait introversion so this leads me not to speak a lot, but I'm always listening intently.",Communicating through writing.,Communicating through speech.,"Practice teamwork and speaking, and polish resume, GitHub, and LinkedIn.",8,"I like to be precise when it comes to communicating through writing. There's something very enjoyable about articulating your thoughts — it's almost as if you are untangling your mind as you write.

I believe it might be because sometimes we can understand something on one level of analysis but not understand it on another. This fact is often attributed to the reason why dreams are often ambiguous and absurd. Dreams are collections of unarticulated thoughts and the dream, in part, is the mind's attempt to express them.

I'm not necessarily a good writer, but I do enjoy the act of writing.","What I'd really like to improve is my ability to communicate through speech because I can be a very awkward speaker. 

For some reason, it's more difficult for me to find the ""right words"" when speaking verbally, but I can write about almost anything no problem. If the topic is technical and complex then it will certainly take a lot longer and more research, but I could do it given enough time.","I wrote a lot for my college classes because the coursework demanded it, but I thoroughly enjoyed it.",The visuals,
7,6/4/2021 13:48:48,-7390225275717912671,Web,HRF Asylum B -- TPL Niki,I speak English and Spanish fluently,YouTube video editor for YouTubers,State management,Node,Problem solving,Time management,Get great projects to show on my portfolio,9,"Coherence, creativity and vocabulary",Nothing,"Creative writing, Songwriting, Twitter threads, Public relations",The script,I wrote comedy scripts for YouTubers 
